{
  "schema": "coursecraft.run/2",
  "run_id": "cc:run:b6e2d7a0-843c-410e-b2bc-4d1bd5437da3",
  "status": "ok",
  "started_at": "2026-10-13T19:25:52.440245Z",
  "finished_at": "2026-10-13T19:25:53.768749Z",
  "source": {
    "source_lineage_key": "cc:lineage:431334cbe13f558a2d72c27c9ee50df8",
    "source_instance_key": "cc:source:d08688cdb116c668b097ac3ef673567150a0001f8bf2b0128cb5f49298a20e36",
    "lineage_state": "unresolved",
    "lineage_basis": "logical_fingerprint",
    "lineage_candidates": [
      {
        "basis": "manifest_identifier",
        "value": "SAMPLE-ROBUST",
        "stability_class": "package_lineage_identifier"
      }
    ],
    "lineage_diagnostics": [
      "primary_identifiers_incomplete"
    ],
    "source_name": "sample_export.zip",
    "logical_fingerprint": {
      "algorithm": "sha256",
      "digest": "d08688cdb116c668b097ac3ef673567150a0001f8bf2b0128cb5f49298a20e36",
      "scope": "logical_file_set",
      "file_count": 30,
      "bytes": 21857,
      "extensions": {
        "skipped_symlink_count": 0
      }
    },
    "transport_fingerprint": {
      "algorithm": "sha256",
      "digest": "8d3f30d12ce71cd75551b40407b59ba52525cebdec61266ca67f852a39f0d64f",
      "scope": "transport_file",
      "bytes": 11538,
      "extensions": {}
    },
    "observed_identity": {
      "source_name": "sample_export.zip",
      "org_unit_id": null,
      "course_code": null,
      "export_timestamp": null,
      "orgunit_identifier": null,
      "orgunit_code": null,
      "orgunit_name": null,
      "manifest_identifier": "SAMPLE-ROBUST",
      "manifest_title": null,
      "manifest_course_code": null,
      "organization_title": null,
      "org_unit_id_basis": null
    },
    "extensions": {}
  },
  "producer": {
    "component": "brightspace-blueprint-bundle",
    "identity_state": "git",
    "version": null,
    "repository": "https://github.com/timebeing92/brightspace-blueprint-bundle.git",
    "ref": "candidate/heading-ownership-2026-10-13",
    "commit": "91b7219e2744cc939e9e60baa9637ad96aeeafa8",
    "dirty": true,
    "extensions": {}
  },
  "contracts": [
    {
      "schema": "coursecraft.activities/1",
      "schema_path": "schemas/activities_schema.json",
      "sha256": "8704770eb98cd9993a5e12235270ef9fae53f306b406023ab950b92c1e8c8f1c",
      "extensions": {}
    },
    {
      "schema": "coursecraft.blueprint/5",
      "schema_path": "schemas/blueprint_schema.json",
      "sha256": "d758c89eb761b888dca8cd1a55997f4fa04f26faca1ac48643d9d3489684610f",
      "extensions": {}
    },
    {
      "schema": "coursecraft.rubrics/1",
      "schema_path": "schemas/rubrics_schema.json",
      "sha256": "8997f8546d803070ec6d38235a25563d3b63a71210b09fb444ed5690ecf3a0b6",
      "extensions": {}
    },
    {
      "schema": "coursecraft.run/2",
      "schema_path": "schemas/run_identity_2_schema.json",
      "sha256": "9b810e6cbb51deacf3255cfa295824bcac31e42e98dfd1c54d44a12fd6b30641",
      "extensions": {}
    },
    {
      "schema": "coursecraft.structure/1",
      "schema_path": "schemas/structure_schema.json",
      "sha256": "858bcca803a5d67b99fb4cdbf348a15096436136ad2f9ef37795aae7cd5c0272",
      "extensions": {}
    }
  ],
  "parameters": {
    "qa_requested": true,
    "external_link_checks_requested": false,
    "linked_syllabus_fetch_requested": true,
    "linked_syllabus_timeout_seconds": 8.0,
    "linked_syllabus_additional_hosts": [],
    "course_title_evidence": {
      "selected": {
        "value": "Sample Course",
        "basis": "explicit_course_title"
      },
      "package_candidates": [],
      "syllabus_candidates": [],
      "diagnostics": []
    },
    "docx_requested": true,
    "docx_structure_check_requested": true,
    "docx_render_check_requested": false,
    "docx_section_layout": "top"
  },
  "steps": [
    {
      "name": "Establish source identity",
      "status": "completed",
      "started_at": "2026-10-13T19:25:52.440245Z",
      "finished_at": "2026-10-13T19:25:52.448117Z",
      "artifact_paths": [],
      "diagnostic_ids": [],
      "notes": [],
      "extensions": {}
    },
    {
      "name": "Inventory export files",
      "status": "completed",
      "started_at": "2026-10-13T19:25:52.448134Z",
      "finished_at": "2026-10-13T19:25:52.502233Z",
      "artifact_paths": [
        "sample_export__inventory.json",
        "sample_export__inventory.md"
      ],
      "diagnostic_ids": [],
      "notes": [],
      "extensions": {}
    },
    {
      "name": "Probe manifest",
      "status": "completed",
      "started_at": "2026-10-13T19:25:52.502589Z",
      "finished_at": "2026-10-13T19:25:52.563892Z",
      "artifact_paths": [
        "sample_export__manifest_probe.json",
        "sample_export__manifest_probe.md"
      ],
      "diagnostic_ids": [],
      "notes": [],
      "extensions": {}
    },
    {
      "name": "Reconstruct course structure",
      "status": "completed",
      "started_at": "2026-10-13T19:25:52.564265Z",
      "finished_at": "2026-10-13T19:25:52.720657Z",
      "artifact_paths": [
        "sample_course__course_structure.json",
        "sample_course__course_structure.md"
      ],
      "diagnostic_ids": [],
      "notes": [],
      "extensions": {}
    },
    {
      "name": "Extract course activities",
      "status": "completed",
      "started_at": "2026-10-13T19:25:52.721088Z",
      "finished_at": "2026-10-13T19:25:52.960492Z",
      "artifact_paths": [
        "sample_course__course_activities.json",
        "sample_course__course_activities.md",
        "sample_course__course_activities.xlsx"
      ],
      "diagnostic_ids": [],
      "notes": [],
      "extensions": {}
    },
    {
      "name": "Extract rubrics",
      "status": "completed",
      "started_at": "2026-10-13T19:25:52.960910Z",
      "finished_at": "2026-10-13T19:25:53.100156Z",
      "artifact_paths": [
        "sample_course__rubrics.docx",
        "sample_course__rubrics.json",
        "sample_course__rubrics.xlsx"
      ],
      "diagnostic_ids": [],
      "notes": [],
      "extensions": {}
    },
    {
      "name": "Run QA report",
      "status": "completed",
      "started_at": "2026-10-13T19:25:53.100491Z",
      "finished_at": "2026-10-13T19:25:53.272114Z",
      "artifact_paths": [
        "sample_course__course_qa.json",
        "sample_course__course_qa.md"
      ],
      "diagnostic_ids": [],
      "notes": [],
      "extensions": {}
    },
    {
      "name": "Assemble blueprint model and Markdown",
      "status": "completed",
      "started_at": "2026-10-13T19:25:53.272522Z",
      "finished_at": "2026-10-13T19:25:53.309143Z",
      "artifact_paths": [
        "sample_course__blueprint.json",
        "sample_course__blueprint.md",
        "sample_course__cps_blueprint.md"
      ],
      "diagnostic_ids": [],
      "notes": [],
      "extensions": {}
    },
    {
      "name": "Render DOCX",
      "status": "completed",
      "started_at": "2026-10-13T19:25:53.309221Z",
      "finished_at": "2026-10-13T19:25:53.537898Z",
      "artifact_paths": [
        "sample_course__blueprint.docx"
      ],
      "diagnostic_ids": [],
      "notes": [],
      "extensions": {}
    },
    {
      "name": "Render rubrics DOCX",
      "status": "completed",
      "started_at": "2026-10-13T19:25:53.538036Z",
      "finished_at": "2026-10-13T19:25:53.655310Z",
      "artifact_paths": [
        "sample_course__rubrics.docx"
      ],
      "diagnostic_ids": [],
      "notes": [],
      "extensions": {}
    },
    {
      "name": "Check DOCX structure",
      "status": "completed",
      "started_at": "2026-10-13T19:25:53.655493Z",
      "finished_at": "2026-10-13T19:25:53.766834Z",
      "artifact_paths": [
        "sample_course__docx_structure.json",
        "sample_course__docx_structure.md"
      ],
      "diagnostic_ids": [],
      "notes": [],
      "extensions": {}
    },
    {
      "name": "Render DOCX preview pages",
      "status": "skipped",
      "started_at": null,
      "finished_at": null,
      "artifact_paths": [],
      "diagnostic_ids": [],
      "notes": [
        "Advanced render preview was not requested."
      ],
      "extensions": {}
    }
  ],
  "emitted_files": [
    {
      "path": "README.md",
      "bytes": 1093,
      "sha256": "e609ba97eaefc812c0403e2fdce227174cada09f4ebce1a0f6b302e96cde92af",
      "media_type": "text/markdown",
      "contract": null,
      "extensions": {}
    },
    {
      "path": "sample_course__blueprint.docx",
      "bytes": 42052,
      "sha256": "e4f5b71ce3b67be18259e8c456eade3079cbe8e5202a1730357fdb8bec4aca25",
      "media_type": "application/vnd.openxmlformats-officedocument.wordprocessingml.document",
      "contract": null,
      "extensions": {}
    },
    {
      "path": "sample_course__blueprint.json",
      "bytes": 31979,
      "sha256": "88299fc979b541db5b2c596da689470c83efef3fe4c47f41c823021f62ba47cc",
      "media_type": "application/json",
      "contract": "coursecraft.blueprint/5",
      "extensions": {}
    },
    {
      "path": "sample_course__blueprint.md",
      "bytes": 10834,
      "sha256": "a42b16c2118bcd348f2c5dea4355c685707870195517e2fd34c2bcd437f8d356",
      "media_type": "text/markdown",
      "contract": null,
      "extensions": {}
    },
    {
      "path": "sample_course__course_activities.json",
      "bytes": 42155,
      "sha256": "087c774e3213dc18519a6ec1e69f2d00a77886b4855b5a6e248c25a1393f8265",
      "media_type": "application/json",
      "contract": "coursecraft.activities/1",
      "extensions": {}
    },
    {
      "path": "sample_course__course_activities.md",
      "bytes": 477,
      "sha256": "2fa44e6c65aa70ead0f7dff9708c087715c5325c0f95789ffbb3d260f3b1a235",
      "media_type": "text/markdown",
      "contract": null,
      "extensions": {}
    },
    {
      "path": "sample_course__course_activities.xlsx",
      "bytes": 11868,
      "sha256": "a08e202a3514a8705749f9da6f849db88794fd18fcb1997d959c3d400d4af476",